{
  "metadata": {
    "title": "Collapse of Symmetry \u2014 Solo in Seven Fractures",
    "source_prompt": "Collapse of Symmetry \u2014 Solo in Seven Fractures. Full 53-measure score in 7/8 time, tempo 144.",
    "ir_version": "0.2.0",
    "schema_version": "0.2.0"
  },
  "symbols": [
    {
      "symbol_id": "music.time.7_8",
      "body_part": "torso",
      "direction": "forward",
      "level": "middle",
      "timing": {
        "measure": 1,
        "beat": 1.0,
        "duration_beats": 1.0
      },
      "modifiers": {
        "measure_header": true,
        "source_text": "7/8 time"
      },
      "rotation_degrees": null,
      "flexion_degrees": null,
      "stage_position": null,
      "facing": null,
      "retention": null
    },
    {
      "symbol_id": "support.stand.place",
      "body_part": "left_leg",
      "direction": "place",
      "level": "middle",
      "timing": {
        "measure": 1,
        "beat": 1.0,
        "duration_beats": 1.5
      },
      "modifiers": {
        "source_text": "Standing on left foot upstage-right"
      },
      "rotation_degrees": null,
      "flexion_degrees": null,
      "stage_position": null,
      "facing": null,
      "retention": null
    },
    {
      "symbol_id": "support.plie.place",
      "body_part": "left_leg",
      "direction": "left",
      "level": "low",
      "timing": {
        "measure": 1,
        "beat": 1.0,
        "duration_beats": 3.0
      },
      "modifiers": {
        "source_text": "Grand pli\u00e9 second position"
      },
      "rotation_degrees": null,
      "flexion_degrees": null,
      "stage_position": null,
      "facing": null,
      "retention": null
    },
    {
      "symbol_id": "support.plie.place",
      "body_part": "right_leg",
      "direction": "right",
      "level": "low",
      "timing": {
        "measure": 1,
        "beat": 1.0,
        "duration_beats": 3.0
      },
      "modifiers": {
        "source_text": "Grand pli\u00e9 second position"
      },
      "rotation_degrees": null,
      "flexion_degrees": null,
      "stage_position": null,
      "facing": null,
      "retention": null
    },
    {
      "symbol_id": "body.bend",
      "body_part": "torso",
      "direction": "forward",
      "level": "low",
      "timing": {
        "measure": 1,
        "beat": 1.0,
        "duration_beats": 3.0
      },
      "modifiers": {
        "effort": {
          "weight": "strong",
          "time": "sudden"
        },
        "source_text": "Torso contraction to flat-back"
      },
      "rotation_degrees": null,
      "flexion_degrees": null,
      "stage_position": null,
      "facing": null,
      "retention": null
    },
    {
      "symbol_id": "gesture.arm",
      "body_part": "left_arm",
      "direction": "forward",
      "level": "high",
      "timing": {
        "measure": 1,
        "beat": 2.0,
        "duration_beats": 2.0
      },
      "modifiers": {
        "source_text": "Arms slash down then shoot to V overhead"
      },
      "rotation_degrees": null,
      "flexion_degrees": null,
      "stage_position": null,
      "facing": null,
      "retention": null
    },
    {
      "symbol_id": "gesture.arm",
      "body_part": "right_arm",
      "direction": "forward",
      "level": "high",
      "timing": {
        "measure": 1,
        "beat": 2.0,
        "duration_beats": 2.0
      },
      "modifiers": {
        "source_text": "Arms slash down then shoot to V overhead"
      },
      "rotation_degrees": null,
      "flexion_degrees": null,
      "stage_position": null,
      "facing": null,
      "retention": null
    },
    {
      "symbol_id": "direction.forward",
      "body_part": "head",
      "direction": "forward",
      "level": "low",
      "timing": {
        "measure": 1,
        "beat": 1.0,
        "duration_beats": 3.0
      },
      "modifiers": {
        "source_text": "Head drops chin to chest"
      },
      "rotation_degrees": null,
      "flexion_degrees": null,
      "stage_position": null,
      "facing": null,
      "retention": null
    },
    {
      "symbol_id": "support.releve.place",
      "body_part": "left_leg",
      "direction": "place",
      "level": "high",
      "timing": {
        "measure": 1,
        "beat": 2.0,
        "duration_beats": 2.0
      },
      "modifiers": {
        "source_text": "Spring to relev\u00e9 left foot"
      },
      "rotation_degrees": null,
      "flexion_degrees": null,
      "stage_position": null,
      "facing": null,
      "retention": null
    },
    {
      "symbol_id": "gesture.leg",
      "body_part": "right_leg",
      "direction": "right",
      "level": "high",
      "timing": {
        "measure": 1,
        "beat": 2.0,
        "duration_beats": 2.0
      },
      "modifiers": {
        "source_text": "Right leg \u00e0 la seconde 90\u00b0"
      },
      "rotation_degrees": null,
      "flexion_degrees": null,
      "stage_position": null,
      "facing": null,
      "retention": null
    },
    {
      "symbol_id": "turn.pivot",
      "body_part": "torso",
      "direction": "right",
      "level": "middle",
      "timing": {
        "measure": 1,
        "beat": 2.0,
        "duration_beats": 2.0
      },
      "modifiers": {
        "rotation_degrees": 90,
        "source_text": "Quarter turn right to face upstage"
      },
      "rotation_degrees": null,
      "flexion_degrees": null,
      "stage_position": null,
      "facing": null,
      "retention": null
    },
    {
      "symbol_id": "gesture.arm",
      "body_part": "left_arm",
      "direction": "right",
      "level": "middle",
      "timing": {
        "measure": 1,
        "beat": 2.0,
        "duration_beats": 2.0
      },
      "modifiers": {
        "source_text": "Left arm crosses to right hip"
      },
      "rotation_degrees": null,
      "flexion_degrees": null,
      "stage_position": null,
      "facing": null,
      "retention": null
    },
    {
      "symbol_id": "gesture.arm",
      "body_part": "right_arm",
      "direction": "diagonal_forward_right",
      "level": "high",
      "timing": {
        "measure": 1,
        "beat": 2.0,
        "duration_beats": 2.0
      },
      "modifiers": {
        "source_text": "Right arm high-right-forward diagonal"
      },
      "rotation_degrees": null,
      "flexion_degrees": null,
      "stage_position": null,
      "facing": null,
      "retention": null
    },
    {
      "symbol_id": "support.lunge",
      "body_part": "right_leg",
      "direction": "right",
      "level": "low",
      "timing": {
        "measure": 1,
        "beat": 3.0,
        "duration_beats": 1.5
      },
      "modifiers": {
        "source_text": "Controlled fall caught in deep lunge right"
      },
      "rotation_degrees": null,
      "flexion_degrees": null,
      "stage_position": null,
      "facing": null,
      "retention": null
    },
    {
      "symbol_id": "gesture.leg",
      "body_part": "left_leg",
      "direction": "backward",
      "level": "low",
      "timing": {
        "measure": 1,
        "beat": 3.0,
        "duration_beats": 1.5
      },
      "modifiers": {
        "source_text": "Left leg extended behind in lunge"
      },
      "rotation_degrees": null,
      "flexion_degrees": null,
      "stage_position": null,
      "facing": null,
      "retention": null
    },
    {
      "symbol_id": "body.bend",
      "body_part": "torso",
      "direction": "right",
      "level": "middle",
      "timing": {
        "measure": 1,
        "beat": 3.0,
        "duration_beats": 1.5
      },
      "modifiers": {
        "source_text": "Torso arches laterally over right leg"
      },
      "rotation_degrees": null,
      "flexion_degrees": null,
      "stage_position": null,
      "facing": null,
      "retention": null
    },
    {
      "symbol_id": "gesture.arm",
      "body_part": "left_arm",
      "direction": "forward",
      "level": "middle",
      "timing": {
        "measure": 2,
        "beat": 1.0,
        "duration_beats": 1.5
      },
      "modifiers": {
        "source_text": "Left arm forward-middle after windmill"
      },
      "rotation_degrees": null,
      "flexion_degrees": null,
      "stage_position": null,
      "facing": null,
      "retention": null
    },
    {
      "symbol_id": "gesture.arm",
      "body_part": "right_arm",
      "direction": "backward",
      "level": "low",
      "timing": {
        "measure": 2,
        "beat": 1.0,
        "duration_beats": 1.5
      },
      "modifiers": {
        "source_text": "Right arm backward-low after windmill"
      },
      "rotation_degrees": null,
      "flexion_degrees": null,
      "stage_position": null,
      "facing": null,
      "retention": null
    },
    {
      "symbol_id": "turn.pivot",
      "body_part": "torso",
      "direction": "right",
      "level": "middle",
      "timing": {
        "measure": 3,
        "beat": 1.0,
        "duration_beats": 2.3
      },
      "modifiers": {
        "rotation_degrees": 360,
        "source_text": "Chain\u00e9 turn 1 slow"
      },
      "rotation_degrees": null,
      "flexion_degrees": null,
      "stage_position": null,
      "facing": null,
      "retention": null
    },
    {
      "symbol_id": "turn.pivot",
      "body_part": "torso",
      "direction": "right",
      "level": "middle",
      "timing": {
        "measure": 3,
        "beat": 3.3,
        "duration_beats": 1.2000000000000002
      },
      "modifiers": {
        "rotation_degrees": 360,
        "source_text": "Chain\u00e9 turn 2 medium"
      },
      "rotation_degrees": null,
      "flexion_degrees": null,
      "stage_position": null,
      "facing": null,
      "retention": null
    },
    {
      "symbol_id": "turn.pivot",
      "body_part": "torso",
      "direction": "right",
      "level": "middle",
      "timing": {
        "measure": 3,
        "beat": 2.65,
        "duration_beats": 1.7
      },
      "modifiers": {
        "rotation_degrees": 360,